484,True,[WIP] Error console and debugging,Changed the order of the error console tabs.  Add CLI switch `--debug` which enables logging of debug messages (shown as `FINE`). ,2015-12-07T18:36:13Z,2016-01-25T17:04:22Z,oscargus,Oscar Gustafsson,8adfa0c6eeee6d39fbcf0b45219a9111186f480f,src/main/java/net/sf/jabref/gui/actions/ErrorConsoleAction.java,8adfa0c6eeee6d39fbcf0b45219a9111186f480f,javax.swing.JTabbedPane,,User Interface,,0,0,0,0,0,0,0,0,0,0,0,0,0,0,0,0,0,0,0,0,0,0,0,0,0,0,0,0,1,0,0,0,0,0,0,1,0,0,0,1,1,1,1,1,0,0,0,0,0,1,0,0,1,1,1,0,1,0,1,0,0,0,0,0,0,0,0,0,0,0,0,0,0,0,0,0,0,0,0,0,0,0,0,0,0,0,0,0,0,0,0,0,0,0,0,0,0,0,0,0,0,0,0,0,0,1,1,0,0,0,0,0,1,0,0,0,1,0,0,0,0,0,0,0,0,0,0,0,0,0,0,0,0,0,0,0,0,0,0,0,0,0,0,0,0,0,0,0,0,0,0,0,0,0,0,0,0,0,0,0,0,0,0,0,0,0,0,0,1,1,0,0,0,0,0,0,0,0,0,0,0,0,0,0,0,0,0,0,0,0,0,0,0,0,0,0,1,1,1,0,0,0,1,0,0,0,0,0,0,0,0,0,0,0,0,0,0
485,True,Removed CsaImporter from the import formats. The csa import format,refers to the cambridge science abstract format which could be obtained on their website csa.com. However the website has been merged with proquest.com and now the there is no export into the csa format available. Therefore we came to the conclusion to remove the support for the csa import format. For more information see also: http://sourceforge.net/p/jabref/mailman/jabref-users/thread/2E36AF04-A83F-44FF-8160-B62EF48B6FAA%40gmail.com/#msg34662091 ,2015-12-08T11:44:16Z,2015-12-08T22:44:50Z,boceckts,Tobias Boceck,b79f92dcdf082dac2b687a05d3e814553000744d,src/main/java/net/sf/jabref/importer/ImportFormatReader.java,b79f92dcdf082dac2b687a05d3e814553000744d,net.sf.jabref.model.entry.BibtexEntry,,Data Structure,,0,0,0,0,0,0,0,0,0,0,0,0,0,0,0,0,0,0,0,0,0,0,0,0,0,0,0,0,0,0,0,0,0,0,0,1,0,0,0,0,0,1,1,0,1,0,0,0,0,0,0,0,0,0,0,0,0,0,0,0,0,0,0,0,0,0,0,0,0,0,0,0,0,0,0,0,0,0,0,0,0,0,0,0,0,0,0,0,0,0,0,0,0,0,0,0,0,0,0,0,0,0,0,0,0,1,0,0,0,0,0,0,1,0,0,0,1,0,0,0,0,0,0,0,0,0,0,0,0,0,0,0,0,0,0,0,0,0,0,0,0,0,0,0,0,0,0,0,0,0,0,0,0,0,0,0,0,0,0,0,0,0,0,0,0,0,0,0,0,0,0,0,0,0,0,0,0,0,0,0,0,0,0,0,0,0,0,0,0,0,0,0,0,0,0,0,0,0,0,0,0,0,0,0,0,0,0,0,0,0,0,0,0,0,0,0,0
486,True,Add autocomplete tests,"- Add mockito test framework: It felt really easy to write tests changing properties with mockito. See for example `NameFieldAutoCompleterTest`, where the preference changes are just a one line thing. This however only works if the dependencies can be easily injected into the class.  - Add a few tests to the AutoCompleter framework. Fixed some NullPointExceptions which I found. - Fixed the bug that short keys and names were not completed, tests: `BibtexKeyAutoCompleterTest.completeShortKeyReturnsKey` and `NameFieldAutoCompleterTest.completeShortNameReturnsName` ",2015-12-08T14:13:25Z,2015-12-10T08:18:47Z,tobiasdiez,Tobias Diez,1e11dec47df656d28cc5c1430d6cc91213b12e95,src/main/java/net/sf/jabref/gui/autocompleter/AutoCompleteRenderer.java,1e11dec47df656d28cc5c1430d6cc91213b12e95,java.util.List,,Data Structure,,0,0,0,0,0,0,0,0,0,0,0,0,0,0,0,0,0,0,0,0,0,0,0,0,0,0,0,0,0,0,0,0,0,0,0,1,0,1,0,1,1,1,1,1,1,0,1,0,1,1,0,0,1,1,1,0,1,0,0,0,0,0,0,1,0,0,0,1,0,0,0,0,0,0,0,0,0,0,0,0,0,0,0,0,0,0,0,0,0,0,0,0,0,0,0,0,0,0,1,0,0,0,0,0,0,1,0,0,0,1,0,0,1,0,0,0,1,0,0,0,0,0,0,0,0,0,0,0,0,0,0,0,0,0,0,0,0,0,0,0,0,0,0,0,0,0,0,0,0,0,0,0,0,0,0,0,0,0,0,0,0,0,0,0,0,0,0,0,1,1,0,1,0,0,0,0,0,0,0,0,0,0,0,0,0,0,0,0,0,0,0,0,0,0,0,0,1,1,1,1,0,0,1,0,0,0,0,0,0,0,0,0,0,0,0,0,0
487,True,PdfXmpImporterTest added,,2015-12-08T14:57:22Z,2015-12-31T13:03:36Z,obraliar,Christian Bartsch,d4b6b6e4a8c2e30a64af2e9bad2365e0b8e03884,src/test/java/net/sf/jabref/importer/fileformat/PdfXmpImporterTest.java,d4b6b6e4a8c2e30a64af2e9bad2365e0b8e03884,net.sf.jabref.importer.OutputPrinterToNull,,Parser,,0,0,0,0,0,0,0,0,0,0,0,0,0,0,0,0,0,0,0,0,0,0,0,0,0,0,0,0,0,0,0,0,0,0,0,1,0,0,0,0,0,0,0,0,0,0,0,0,0,1,0,0,0,0,1,0,1,0,0,0,0,0,0,0,0,0,0,0,0,0,0,0,0,0,0,0,0,1,0,0,0,0,0,0,0,0,0,0,0,0,0,0,0,0,0,0,0,0,0,0,0,0,0,0,0,0,0,0,0,0,0,0,0,0,0,0,0,0,0,0,0,0,0,0,0,0,0,0,0,0,0,0,0,0,0,0,0,0,0,0,0,0,0,0,0,0,0,0,0,0,0,0,0,0,0,0,0,0,0,0,0,0,0,0,0,0,0,0,1,0,0,0,0,0,0,0,0,0,0,0,0,0,0,0,0,0,0,0,0,0,0,0,0,0,0,0,0,0,0,0,0,0,0,0,0,0,0,0,0,0,1,1,0,0,0,0,0
488,True,IEEEXplore fetcher downloads the raw bibtex records from IEEEXplore,"Summary of changes - moved away from the freesearchresult.jsp script for older browsers (notice on the IEEE suggests support for this will be dropped in Jan 2016), instead use the 'search' script and POST method - results are returned in JSON format and the article numbers are obtained directly; HTML parsing has been removed - the article numbers are used to construct a second query for the raw Bibtex records, which now captures all fields available from the IEEE - the Bibtex entries are still passed to the existing cleanup() routine to improve the formatting consistency - cleaned up unsued code as a result of the changes (removed HTML parsing code) - added a method to Util for performing HTTP POST ",2015-12-08T18:46:05Z,2015-12-23T10:20:59Z,jeff-kerr,Jeff Kerr,2a428a7bdf171003c82b102c8dd0381f3d55d7fa,src/main/java/net/sf/jabref/importer/fetcher/IEEEXploreFetcher.java,2a428a7bdf171003c82b102c8dd0381f3d55d7fa,org.json.JSONException,,Parser,,0,0,0,0,0,0,0,0,0,0,0,0,0,0,0,0,0,0,0,0,0,0,0,0,0,0,0,0,1,0,0,0,0,0,0,1,0,0,0,1,0,1,1,1,1,1,1,0,0,1,0,0,1,1,0,0,1,0,0,0,0,0,0,0,0,0,0,0,0,0,0,0,0,0,0,0,0,1,1,0,0,0,0,0,0,0,0,0,0,0,0,0,0,0,0,0,0,0,0,0,0,0,0,0,0,1,0,0,0,1,0,0,1,0,0,0,1,0,0,0,0,0,0,0,0,0,0,0,0,0,0,0,0,0,0,0,0,0,0,0,0,0,0,0,0,0,0,0,0,0,0,0,0,0,0,0,0,0,0,0,0,0,0,0,0,0,0,0,1,0,1,1,0,0,1,0,0,0,0,0,0,0,0,0,0,0,0,0,0,0,0,0,0,0,0,0,1,1,1,0,0,0,1,1,1,0,0,0,0,0,0,0,0,0,0,0,0
491,True,Add close all/others/... in Database Tab menu,See #314  ,2015-12-09T13:26:34Z,2015-12-09T14:14:36Z,stefan-kolb,Stefan Kolb,4fd2be19bb24918443edaad46bdf1a009bda4ea2,src/main/java/net/sf/jabref/gui/DragDropPopupPane.java,4fd2be19bb24918443edaad46bdf1a009bda4ea2,java.awt.event.MouseEvent,,User Interface,,0,0,0,0,0,0,0,0,0,0,0,0,0,0,0,0,0,0,0,0,0,0,0,0,0,0,0,0,1,0,0,0,0,0,0,1,1,1,0,1,1,1,1,1,1,0,1,0,1,1,0,0,1,0,1,0,1,0,0,0,0,0,0,1,0,0,0,0,0,0,0,0,0,0,0,0,0,0,0,0,0,0,0,0,0,0,0,0,0,0,0,0,0,0,0,0,0,0,1,1,1,0,0,0,0,1,0,0,0,1,0,0,1,0,0,0,1,0,0,0,0,0,0,0,0,0,0,0,0,0,0,0,0,1,0,0,0,0,0,0,0,0,0,0,0,0,0,0,0,0,0,0,0,0,0,0,0,0,0,0,0,0,0,0,0,0,0,0,1,1,0,1,0,0,0,0,0,0,0,0,0,0,0,0,0,0,0,0,0,0,0,0,0,0,0,0,1,1,1,0,0,0,1,0,0,0,0,0,0,0,0,0,0,0,0,0,0
500,True,Database type detection,"Please see `BibDatabaseTypeDetection.java`for review.  Some refactoring and a class for auto-detection of database types. ### Algorithm - should we introduce a hard-coded field like encodings inside the bib file? - fast-enough? - what about false detection? ### Refactoring - Bibtexdatabase -> BibDatabase - BibtexEntry -> BibEntry  also see #495, #167 ",2015-12-10T15:32:25Z,2015-12-15T13:07:30Z,stefan-kolb,Stefan Kolb,7d885408f4182d8627debd0888b68a516f3d1468,src/main/java/net/sf/jabref/groups/structure/AllEntriesGroup.java,7d885408f4182d8627debd0888b68a516f3d1468,net.sf.jabref.model.entry.BibEntry,,Software Development and IT Operations,,0,0,0,0,0,0,0,1,0,0,0,0,0,0,0,0,0,0,0,0,0,0,0,0,0,0,0,0,1,1,0,1,1,0,1,1,1,1,1,1,1,1,1,1,1,1,1,1,1,1,0,0,1,1,1,1,1,1,0,0,0,0,0,1,1,0,0,1,0,0,0,0,0,0,0,0,0,1,1,1,1,0,0,0,1,0,0,0,0,0,0,0,0,0,0,0,0,0,1,0,1,0,1,1,0,1,1,0,0,1,0,1,1,0,0,0,1,0,0,0,0,0,0,0,0,0,0,0,0,0,0,0,0,0,0,0,0,0,0,0,0,0,0,0,0,0,0,0,0,0,0,0,0,0,1,1,1,1,0,0,0,0,0,0,0,0,0,0,1,1,1,1,0,0,1,1,0,1,0,0,0,0,0,0,0,0,0,0,0,0,0,0,0,0,0,0,1,1,1,1,0,0,1,1,1,0,1,0,1,0,0,0,0,0,0,0,0
501,True,[WIP] Prototype for new EntryType interface,"This is a prototype for an idea to resolve the issues discussed in #337 and #495.  Right now the entry type is converted from a string representation (in the bibtex file) to an EntryType by the parser. The problem with this approach is that the parser has to know about the bibtex vs biblatex mode. The idea was to add an intermediate step: String (in Bibtex file) -> EntryClass (by parser) -> EntryType (by some factory using information from the preferences) - There is an enum `StandardEntryClass` holding all the standard types regardless of bibtex or biblatex (so article, mvbook, etc, all are there). To support also unknown entry types we have the class `NonStandardEntryClass`. So for example, parsing `@article{}` results in `class = StandardEntryClass.ARTICLE` while `@gibberish{}` yields `class = NonStandardEntryClass` with name `gibberish`. In this way the type information is stored in a relative convenient form (better then a string).  The idea of an enum implementing an interface was taken from the way java handles standard file locations. See [the oracle blog ](https://blogs.oracle.com/darcy/entry/enums_and_mixins) (or [another blog](http://blog.pengyifan.com/how-to-extend-enum-in-java/)). - The `EntryClass` does not know about required and optional fields. These information are provided by the `EntryTypeFactory`. For example, `entryTypeFactory(prefs).getTypeFor(StandardEntryClass.ARTICLE).getRequiredFields()` gives the required fields.   Please ignore all the ""my"" prefixes in the class names. ",2015-12-10T19:51:12Z,2015-12-29T19:12:16Z,tobiasdiez,Tobias Diez,7ffeaba324d554e6595960ba9cd09e684a181b87,src/main/java/net/sf/jabref/model/entry/MyEntryTypeFactory.java,7ffeaba324d554e6595960ba9cd09e684a181b87,net.sf.jabref.JabRefPreferences,,Software Development and IT Operations,,0,0,0,0,0,0,0,0,0,0,0,0,0,0,0,0,0,0,0,0,0,0,0,0,0,0,0,0,0,0,0,0,0,0,0,1,0,0,0,0,0,0,1,1,1,1,1,0,0,1,0,0,1,0,0,0,1,0,0,0,0,0,0,1,0,0,0,0,0,0,0,0,0,0,0,0,0,1,1,0,0,0,0,0,0,0,0,0,0,0,0,0,0,0,0,0,0,0,0,0,0,0,0,0,0,1,0,0,0,1,0,0,1,0,0,0,1,0,0,0,0,0,0,0,0,0,0,0,0,0,0,0,0,0,0,0,0,0,0,0,0,0,0,0,0,0,0,0,0,0,0,0,0,0,0,0,0,0,0,0,0,0,0,0,0,0,0,0,0,0,0,0,0,0,0,0,0,0,0,0,0,0,0,0,0,0,0,0,0,0,0,0,0,0,0,0,0,0,0,0,0,0,0,0,0,0,0,0,0,0,0,0,0,0,0,0,0
502,True,Unused code,Removes unused code. Rationales are given for each removal in commit message. ,2015-12-11T01:38:51Z,2015-12-11T09:36:51Z,stefan-kolb,Stefan Kolb,c4406db3af1ca0f87eedf1de503ee16dffdd3cc2,src/main/java/net/sf/jabref/external/FindFullText.java,c4406db3af1ca0f87eedf1de503ee16dffdd3cc2,net.sf.jabref.model.entry.BibtexEntry,,Data Structure,,0,0,0,0,0,0,0,0,0,0,0,0,0,0,0,0,0,0,0,0,0,0,0,0,0,0,0,0,1,0,0,0,0,0,0,1,0,0,0,0,0,0,1,1,0,1,1,0,0,1,0,0,0,1,0,0,1,0,0,0,0,0,0,0,0,0,0,0,0,0,0,0,0,0,0,0,0,1,0,0,0,0,0,0,1,0,0,0,0,0,0,0,0,0,0,0,0,0,0,0,0,0,0,0,0,1,0,0,0,1,0,0,1,0,0,0,1,0,0,0,0,0,0,0,0,0,0,0,0,0,0,0,0,0,0,0,0,0,0,0,0,0,0,0,0,0,0,0,0,0,0,0,0,0,0,0,0,0,0,0,0,0,0,0,0,0,0,0,1,0,0,0,0,0,0,0,0,0,0,0,0,0,0,0,0,0,0,0,0,0,0,0,0,0,0,0,1,1,1,0,0,0,1,0,0,0,0,0,0,0,0,0,0,0,0,0,0
504,True,BiblioscapeImporterTest,,2015-12-13T00:54:23Z,2016-04-07T11:46:16Z,obraliar,Admir Obralija,70ab552c10d87d1150f140aef57825e2765ad21c,src/test/java/net/sf/jabref/importer/fileformat/BiblioscapeImporterTest.java,70ab552c10d87d1150f140aef57825e2765ad21c,java.io.InputStream,,Input-Output,,0,0,0,0,0,0,0,0,0,0,0,0,0,0,0,0,0,0,0,0,0,0,0,0,0,0,0,0,0,0,0,0,0,0,0,1,0,0,0,0,0,0,0,0,0,0,0,0,0,1,0,0,0,1,1,0,1,0,0,0,0,0,0,0,0,0,0,0,0,0,0,0,0,0,0,0,0,1,0,0,0,0,0,0,0,0,0,0,0,0,0,0,0,0,0,0,0,0,0,0,0,0,0,0,0,1,0,0,0,0,0,0,0,0,0,0,0,0,0,0,0,0,0,0,0,0,0,0,0,0,0,0,0,0,0,0,0,0,0,0,0,0,0,0,0,0,0,0,0,0,0,0,0,0,0,0,0,0,0,0,0,0,0,0,0,0,0,0,1,0,0,0,0,0,0,0,0,0,0,0,0,0,0,0,0,0,0,0,0,0,0,0,0,0,0,0,0,0,0,0,0,0,0,0,0,0,0,0,0,0,0,0,0,0,0,0,0
506,True,Isiimportertest,,2015-12-13T18:13:28Z,2015-12-23T08:58:26Z,obraliar,Sascha Zeller,27a0b94ecf2df2c005adf409b6e03847db39ffbd,src/test/java/net/sf/jabref/importer/fileformat/IsiImporterTest.java,27a0b94ecf2df2c005adf409b6e03847db39ffbd,net.sf.jabref.importer.OutputPrinterToNull,,Parser,,0,0,0,0,0,0,0,0,0,0,0,0,0,0,0,0,0,0,0,0,0,0,0,0,0,0,0,0,0,0,0,0,0,0,0,1,0,0,0,0,0,0,0,0,0,0,0,0,0,1,0,0,0,0,1,0,1,0,0,0,0,0,0,0,0,0,0,0,0,0,0,0,0,0,0,0,0,1,0,0,0,0,0,0,0,0,0,0,0,0,0,0,0,0,0,0,0,0,0,0,0,0,0,0,0,0,0,0,0,0,0,0,0,0,0,0,0,0,0,0,0,0,0,0,0,0,0,0,0,0,0,0,0,0,0,0,0,0,0,0,0,0,0,0,0,0,0,0,0,0,0,0,0,0,0,0,0,0,0,0,0,0,0,0,0,0,0,0,1,0,0,0,0,0,0,0,0,0,0,0,0,0,0,0,0,0,0,0,0,0,0,0,0,0,0,0,0,0,0,0,0,0,0,0,0,0,0,0,0,0,1,1,0,0,0,0,0
507,True,Gui testing,"Adds the ability to do GUI tests automatically.   With just 80 lines of testing code, I was able to raise the code coverage by 15%. And I detected two NullPointerExceptions (still to be fixed) plus three places where Swing classes were interacted with outside of the EDT.   This change allows to model bug reports as test cases on a GUI level.   What has been done - [x] Tests fail when an uncaught Exception occurs on the EDT - [x] Raise test coverageby 15% - [x] GUI tests run on CircleCI - [x] Fix language to english for all (GUI) tests - [x] somehow only run the tests on CircleCI? - [x] maybe use headless mode @matthiasgeiger - NOT POSSIBLE WITH THE USED API - [x] make it work with Gradle sync in Intellij so that one can edit the tests and run them from within the IDE - [x] make tests work on travis-ci - [x] enable tests on circle-ci as well ",2015-12-14T13:03:07Z,2016-03-15T13:46:06Z,simonharrer,Simon Harrer,8ed2a608c1c1fb69409e507b70c60a5af437f236,src/main/java/net/sf/jabref/groups/structure/AllEntriesGroup.java,8ed2a608c1c1fb69409e507b70c60a5af437f236,net.sf.jabref.model.entry.BibEntry,,Software Development and IT Operations,,0,0,0,0,0,0,0,0,0,0,0,0,0,0,0,0,0,0,0,0,0,0,0,0,0,0,0,0,1,1,0,1,1,0,1,1,1,1,1,1,1,1,1,1,1,1,1,1,1,1,0,0,1,1,1,1,1,1,0,0,0,0,0,1,1,0,0,1,0,0,0,0,0,0,0,0,0,1,1,1,0,0,0,0,1,0,0,0,0,0,0,0,0,0,0,0,0,0,1,1,1,1,1,1,0,1,1,0,0,1,0,0,1,0,0,0,1,0,0,0,0,0,0,0,0,0,0,0,0,0,0,0,0,1,0,0,0,0,0,0,1,1,0,1,0,0,0,0,0,0,0,0,0,0,1,1,1,1,0,0,0,0,0,0,0,0,0,0,1,1,1,1,0,0,1,1,0,1,0,0,0,0,0,0,0,0,0,0,0,0,0,0,0,0,0,0,1,1,1,1,0,0,1,1,1,0,1,0,1,0,1,0,0,0,0,0,0
508,True,MsBibImporterTest,"  the part, that is commented   ``` java          //         NodeList rootLst = docin.getElementsByTagName(""b:Sources"");         //          if(rootLst.getLength()==0)         //              rootLst = docin.getElementsByTagName(""Sources"");         //          if(rootLst.getLength()==0)         //              return false;         // System.out.println(docin.getDocumentElement().getTagName()); ```  is covered with the part   ``` java if ((docin != null) && !docin.getDocumentElement().getTagName().contains(""Sources"")) {             return false;         } ```  because in the commented part, you check, wether there is an element ""b:Sources"". If not, then you check wether there is an element with sources. When you check wether there is an element,which contains ""Sources"", you have both in one. Also if there stands something before or after ""Sources"", then you go in the if part despite of what stands before or after ""Sources"".   So we deleted the commented part.  ",2015-12-14T18:47:51Z,2016-04-07T11:45:11Z,tschechlovdev,Dennis Tschechlov,aff671299d33e431556206123b08089f62f3e512,src/test/java/net/sf/jabref/importer/fileformat/MsBibImporterTest.java,aff671299d33e431556206123b08089f62f3e512,net.sf.jabref.importer.OutputPrinterToNull,,Parser,,0,0,0,0,0,0,0,0,0,0,0,0,0,0,0,0,0,0,0,0,0,0,0,0,0,0,0,0,0,0,0,0,0,0,0,1,0,0,0,0,0,0,0,0,0,0,0,0,0,1,0,0,0,0,0,0,1,0,0,0,0,0,0,0,0,0,0,0,0,0,0,0,0,0,0,0,0,1,0,0,0,0,0,0,0,0,0,0,0,0,0,0,0,0,0,0,0,0,0,0,0,0,0,0,0,0,0,0,0,0,0,0,0,0,0,0,0,0,0,0,0,0,0,0,0,0,0,0,0,0,0,0,0,0,0,0,0,0,0,0,0,0,0,0,0,0,0,0,0,0,0,0,0,0,0,0,0,0,0,0,0,0,0,0,0,0,0,0,1,0,0,0,0,0,0,0,0,0,0,0,0,0,0,0,0,0,0,0,0,0,0,0,0,0,0,0,0,0,0,0,0,0,0,0,0,0,0,0,0,0,0,0,0,0,0,0,0
510,True,SilverPlatterImporterTest,,2015-12-14T20:54:37Z,2016-04-07T09:06:31Z,tschechlovdev,Dennis Tschechlov,5cd10ee91b693e896b714776ab7887cac76553c1,src/test/java/net/sf/jabref/importer/fileformat/SilverPlatterImporterTestNotRecognized.java,5cd10ee91b693e896b714776ab7887cac76553c1,java.util.List,,Data Structure,,0,0,0,0,0,0,0,0,0,0,0,0,0,0,0,0,0,0,0,0,0,0,0,0,0,0,0,0,0,0,0,0,0,0,0,1,0,0,0,0,0,0,0,0,0,0,0,0,0,1,0,0,0,1,0,0,1,0,0,0,0,0,0,0,0,0,0,0,0,0,0,0,0,0,0,0,0,1,0,0,0,0,0,0,0,0,0,0,0,0,0,0,0,0,0,0,0,0,0,0,0,0,0,0,0,1,0,0,0,1,0,0,0,0,0,0,0,0,0,0,0,0,0,0,0,0,0,0,0,0,0,0,0,0,0,0,0,0,0,0,0,0,0,0,0,0,0,0,0,0,0,0,0,0,0,0,0,0,0,0,0,0,0,0,0,0,0,0,1,0,0,0,0,0,0,0,0,0,0,0,0,0,0,0,0,0,0,0,0,0,0,0,0,0,0,0,0,0,0,0,0,0,0,0,0,0,0,0,0,0,0,0,0,0,0,0,0
511,True,BibTeXMLImporterTest,,2015-12-14T21:36:16Z,2016-04-15T08:56:31Z,zesaro,Sascha Zeller,ebf7b0249a03611a34d57b0fd2d736f05b218923,src/main/java/net/sf/jabref/importer/ImportFormatReader.java,ebf7b0249a03611a34d57b0fd2d736f05b218923,net.sf.jabref.model.entry.BibEntry,,Software Development and IT Operations,,0,0,0,0,0,0,0,0,0,0,0,0,0,0,0,0,0,0,0,0,0,0,0,0,0,0,0,0,1,0,0,0,0,0,1,1,0,1,0,1,1,1,1,1,1,1,1,1,1,1,0,0,1,1,1,0,1,0,0,0,0,0,0,1,1,0,0,1,0,0,0,0,0,0,0,0,0,1,1,0,0,0,0,0,0,0,0,0,0,0,0,0,0,0,0,0,0,0,1,0,0,0,1,1,0,1,1,0,0,1,0,0,1,0,0,0,1,0,0,0,0,0,0,0,0,0,0,0,0,0,0,0,0,0,0,0,0,0,0,0,0,0,0,0,0,0,0,0,0,0,0,0,0,0,0,0,0,0,0,0,0,0,0,0,0,0,0,0,1,1,1,1,0,0,1,1,0,0,0,0,0,0,0,0,0,0,0,0,0,0,0,0,0,0,0,0,1,1,1,1,0,0,1,1,0,0,0,0,0,0,1,1,0,0,0,0,0
512,True,OvidImporterTest,,2015-12-14T22:13:51Z,2016-01-18T11:40:09Z,zesaro,Sascha Zeller,350807c112d30969a842b7a6778269ea9ca684e5,src/test/java/net/sf/jabref/importer/fileformat/OvidImporterTest.java,350807c112d30969a842b7a6778269ea9ca684e5,net.sf.jabref.importer.OutputPrinterToNull,,Parser,,0,0,0,0,0,0,0,0,0,0,0,0,0,0,0,0,0,0,0,0,0,0,0,0,0,0,0,0,0,0,0,0,0,0,0,1,0,0,0,0,0,0,0,0,0,0,0,0,0,1,0,0,0,0,1,0,1,0,0,0,0,0,0,0,0,0,0,0,0,0,0,0,0,0,0,0,0,1,1,0,0,0,0,0,0,0,0,0,0,0,0,0,0,0,0,0,0,0,0,0,0,0,0,0,0,1,0,0,0,1,0,0,0,0,0,0,0,0,0,0,0,0,0,0,0,0,0,0,0,0,0,0,0,0,0,0,0,0,0,0,0,0,0,0,0,0,0,0,0,0,0,0,0,0,0,0,0,0,0,0,0,0,0,0,0,0,0,0,1,0,0,0,0,0,0,0,0,0,0,0,0,0,0,0,0,0,0,0,0,0,0,0,0,0,0,0,0,0,0,0,0,0,0,0,0,0,0,0,0,0,0,0,0,0,0,0,0
513,True,RepecNepImporterTest,,2015-12-14T23:35:48Z,2016-01-15T18:48:05Z,tschechlovdev,Dennis Tschechlov,496e93c48f17971d831ec826782d8896a2cf9a52,src/main/java/net/sf/jabref/importer/fileformat/RepecNepImporter.java,496e93c48f17971d831ec826782d8896a2cf9a52,org.apache.commons.logging.Log,,Logging,,0,0,0,0,0,0,0,0,0,0,0,0,0,0,0,0,0,0,0,0,0,0,0,0,0,0,0,0,0,0,0,0,0,0,0,1,0,0,0,0,0,0,0,0,0,0,0,0,0,1,0,0,1,1,1,0,1,0,0,0,0,0,0,0,0,0,0,0,0,0,0,0,0,0,0,0,0,1,1,0,0,0,0,0,0,0,0,0,0,0,0,0,0,0,0,0,0,0,0,0,0,0,0,0,0,1,0,0,0,0,0,0,1,0,0,0,1,0,0,0,0,0,0,0,0,0,0,0,0,0,0,0,0,0,0,0,0,0,0,0,0,0,0,0,0,0,0,0,0,0,0,0,0,0,0,0,0,0,0,0,0,0,0,0,0,0,0,0,1,0,0,0,0,0,0,0,0,0,0,0,0,0,0,0,0,0,0,0,0,0,0,0,0,0,0,0,0,0,0,0,0,0,0,0,0,0,0,0,0,0,0,0,0,0,0,0,0
515,True,BibtexImporter test,"Added tests for BibtexImporter, depends on PR #514 (missing Gradle test encoding, special char 'ß') ",2015-12-15T13:06:04Z,2015-12-23T13:44:15Z,chriba,Christian Bartsch,ee515ab8c27437c8b5f84aa3c5b0a7b993c3492f,src/test/java/net/sf/jabref/importer/fileformat/BibtexImporterTest.java,ee515ab8c27437c8b5f84aa3c5b0a7b993c3492f,net.sf.jabref.importer.OutputPrinterToNull,,Parser,,0,0,0,0,0,0,0,0,0,0,0,0,0,0,0,0,0,0,0,0,0,0,0,0,0,0,0,0,0,0,0,0,0,0,0,1,0,0,0,0,0,0,0,0,0,0,0,0,0,1,0,0,0,0,1,0,1,0,0,0,0,0,0,0,0,0,0,0,0,0,0,0,0,0,0,0,0,1,0,0,0,0,0,0,0,0,0,0,0,0,0,0,0,0,0,0,0,0,0,0,0,0,0,0,0,0,0,0,0,0,0,0,0,0,0,0,0,0,0,0,0,0,0,0,0,0,0,0,0,0,0,0,0,0,0,0,0,0,0,0,0,0,0,0,0,0,0,0,0,0,0,0,0,0,0,0,0,0,0,0,0,0,0,0,0,0,0,0,1,0,0,0,0,0,0,0,0,0,0,0,0,0,0,0,0,0,0,0,0,0,0,0,0,0,0,0,0,0,0,0,0,0,0,0,0,0,0,0,0,0,0,0,0,0,0,0,0
517,True,Fixed null issue in GoogleScholarFetcher,Fix so that the Google Scholar fetcher is working again after the new BibtexEntry class require nun-null values. ,2015-12-15T15:18:11Z,2015-12-15T15:24:24Z,oscargus,Oscar Gustafsson,d3e8b1a9a0ef4f0514e7761ac8036bb9b016bb11,src/main/java/net/sf/jabref/importer/fetcher/GoogleScholarFetcher.java,d3e8b1a9a0ef4f0514e7761ac8036bb9b016bb11,net.sf.jabref.gui.FetcherPreviewDialog,,User Interface,,0,0,0,0,0,0,0,0,0,0,0,0,0,0,0,0,0,0,0,0,0,0,0,0,0,0,0,0,0,0,0,0,0,0,0,0,0,0,0,0,0,0,0,0,0,0,0,0,0,1,0,0,0,1,1,0,0,0,0,0,0,0,0,0,0,0,0,0,0,0,0,0,0,0,0,0,0,1,0,0,0,0,0,0,0,0,0,0,0,0,0,0,0,0,0,0,0,0,0,0,0,0,0,0,0,1,0,0,0,1,0,0,1,0,0,0,1,0,0,0,0,0,0,0,0,0,0,0,0,0,0,0,0,0,0,0,0,0,0,0,0,0,0,0,0,0,0,0,0,0,0,0,0,0,0,0,0,0,0,0,0,0,0,0,0,0,0,0,1,1,0,0,0,0,0,0,0,0,0,0,0,0,0,0,0,0,0,0,0,0,0,0,0,0,0,0,1,0,1,0,0,0,0,0,0,0,0,0,0,0,0,0,0,0,0,0,0
519,True,Fixed all fields set to null,"As entry.setField() does not accept a null argument anymore, the method entry.clearField() is used instead. ",2015-12-15T15:34:10Z,2015-12-15T15:39:39Z,oscargus,Oscar Gustafsson,e8e2c8979fb9b05ccaa07d17a3b83327077b3499,src/main/java/net/sf/jabref/gui/mergeentries/MergeEntries.java,e8e2c8979fb9b05ccaa07d17a3b83327077b3499,net.sf.jabref.MetaData,,Language,,0,0,0,0,0,0,0,0,0,0,0,0,0,0,0,0,0,0,0,0,0,0,0,0,0,0,0,0,0,0,0,0,0,0,0,1,0,0,0,0,0,0,1,0,0,0,0,0,0,1,0,0,1,1,1,0,1,0,0,0,0,0,0,1,0,0,0,0,0,0,0,0,0,0,0,0,0,1,0,0,0,0,0,0,0,0,0,0,0,0,0,0,0,0,0,0,0,0,1,0,0,0,0,0,0,1,0,0,0,1,0,0,1,0,0,0,1,0,0,0,0,0,0,0,0,0,0,0,0,0,0,0,0,0,0,0,0,0,0,0,0,0,0,0,0,0,0,0,0,0,0,0,0,0,0,0,0,0,0,0,0,0,0,0,0,0,0,0,1,1,1,1,0,0,1,0,0,0,0,0,0,0,0,0,0,0,0,0,0,0,0,0,0,0,0,0,1,0,1,0,0,0,0,1,1,0,0,0,0,0,0,0,0,0,0,0,0
530,True,Fixed #526,Now the OpenOffice/LibreOffice should work again on Linux (and on OSX). ,2015-12-16T14:53:07Z,2015-12-17T08:12:31Z,oscargus,Oscar Gustafsson,a81745e0b0d81a0b457a7eecf33bd83d8ffef72c,src/main/java/net/sf/jabref/openoffice/OpenOfficePanel.java,a81745e0b0d81a0b457a7eecf33bd83d8ffef72c,java.awt.event.ActionEvent,,User Interface,,0,0,0,0,0,0,0,1,0,0,0,0,0,0,0,0,0,0,0,0,0,0,0,0,0,0,0,0,1,0,0,0,0,0,0,1,0,1,0,0,0,0,1,1,0,0,0,0,0,1,0,0,1,1,1,0,1,0,0,0,0,0,0,0,0,0,0,0,0,0,0,0,0,0,0,0,0,0,0,0,0,0,0,0,1,0,0,0,0,0,0,0,0,0,0,0,0,0,0,0,0,0,0,0,0,1,0,0,0,1,0,0,1,0,0,0,1,0,0,0,0,0,0,0,0,0,0,0,0,0,0,0,0,0,0,0,0,0,0,0,0,0,0,0,0,0,0,0,0,0,0,0,0,0,0,0,0,0,0,0,0,0,0,0,0,0,0,0,1,0,0,0,0,0,0,0,0,0,0,0,0,0,0,0,0,0,0,0,0,0,0,0,0,0,0,0,1,1,1,0,0,0,0,0,0,0,0,0,0,0,0,0,0,0,0,0,0
531,True,Import Format Reader Fix,"The Problem is, that the stream can not be resetted without a BufferedInputStream.  However this is necessary since we check if a import file is in the right format with looking into the stream and searching for specific patterns.  Result of the above mentioned issue is that I always got an error message saying ""No entries found"" when trying to import a file with a valid format and entries.   This fixes the issue without changing any method interfaces. ",2015-12-17T12:29:09Z,2015-12-21T13:48:14Z,boceckts,Tobias Boceck,c0ec6d151c58a92e93de1463dec383cc4cd03689,src/main/java/net/sf/jabref/importer/ImportFormatReader.java,c0ec6d151c58a92e93de1463dec383cc4cd03689,net.sf.jabref.model.entry.BibEntry,,Software Development and IT Operations,,0,0,0,0,0,0,0,0,0,0,0,0,0,0,0,0,0,0,0,0,0,0,0,0,0,0,0,0,0,0,0,0,0,0,0,0,0,0,0,0,0,0,0,0,0,0,0,0,0,1,0,0,0,1,0,0,0,0,0,0,0,0,0,0,0,0,0,0,0,0,0,0,0,0,0,0,0,0,0,0,0,0,0,0,0,0,0,0,0,0,0,0,0,0,0,0,0,0,0,0,0,0,0,0,0,1,0,0,0,0,0,0,1,0,0,0,1,0,0,0,0,0,0,0,0,0,0,0,0,0,0,0,0,0,0,0,0,0,0,0,0,0,0,0,0,0,0,0,0,0,0,0,0,0,0,0,0,0,0,0,0,0,0,0,0,0,0,0,0,0,0,0,0,0,0,0,0,0,0,0,0,0,0,0,0,0,0,0,0,0,0,0,0,0,0,0,0,0,0,0,0,0,0,0,0,0,0,0,0,0,0,0,0,0,0,0,0
536,True,Changes to ParserResult warnings,Some restructuring of the ParserResult warnings code. Introduced a new class that is used in a number of other classes to do the same thing. ,2015-12-18T14:03:50Z,2015-12-21T09:33:27Z,oscargus,Oscar Gustafsson,24e1a3d9ddfdc903e04271490919e1d0f740e526,src/main/java/net/sf/jabref/importer/ImportMenuItem.java,24e1a3d9ddfdc903e04271490919e1d0f740e526,java.awt.event.ActionEvent,,User Interface,,0,0,0,0,0,0,0,0,0,0,0,0,0,0,0,0,0,0,0,0,0,0,0,0,0,0,0,0,1,0,0,0,0,0,1,1,0,0,0,1,1,1,1,1,1,1,0,0,1,1,0,0,1,1,1,0,1,1,0,0,0,0,0,1,1,0,0,1,0,0,0,0,0,0,0,0,0,1,1,0,0,0,0,0,0,0,0,0,0,0,0,0,0,0,0,0,0,0,0,0,0,0,0,0,0,1,1,0,0,1,0,0,1,0,0,0,1,0,0,0,0,0,0,0,0,0,0,0,0,0,0,0,0,0,0,0,0,0,0,0,0,0,0,0,0,0,0,0,0,0,0,0,0,0,0,0,0,0,0,0,0,0,0,0,0,0,0,0,1,1,1,0,0,0,1,1,0,0,0,0,0,0,0,0,0,0,0,0,0,0,0,0,0,0,0,0,1,0,1,1,0,0,1,0,0,0,0,0,0,0,0,0,0,0,0,0,0
538,True,Extracted FieldExtra components to separate class,,2015-12-19T21:09:31Z,2015-12-21T10:54:21Z,oscargus,Oscar Gustafsson,605bb495bb19d3c84169f32defa478ed9aade417,src/main/java/net/sf/jabref/gui/entryeditor/FieldExtraComponents.java,605bb495bb19d3c84169f32defa478ed9aade417,java.awt.event.MouseEvent,,User Interface,,0,0,0,0,0,0,0,0,0,0,0,0,0,0,0,0,0,0,0,0,0,0,0,0,0,0,0,0,1,0,0,0,0,0,1,1,0,0,0,0,0,0,1,1,0,1,0,0,0,1,0,0,1,0,1,0,1,0,0,0,0,0,0,1,1,0,0,1,0,0,0,0,0,0,0,0,0,0,0,0,0,0,0,0,0,0,0,0,0,0,0,0,0,0,0,0,0,0,0,0,0,0,0,0,0,1,0,0,0,1,0,0,1,0,0,0,1,0,0,0,0,0,0,0,0,0,0,0,0,0,0,0,0,0,0,0,0,0,0,0,0,0,0,0,0,0,0,0,0,0,0,0,0,0,0,0,0,0,0,0,0,0,0,0,0,0,0,0,1,1,1,0,0,0,1,1,0,0,0,0,0,0,0,0,0,0,0,0,0,0,0,0,0,0,0,0,1,1,1,1,0,0,1,0,0,0,0,0,0,0,0,0,0,0,0,0,0
540,True,Some minor Coverity warning fixes,,2015-12-19T21:48:01Z,2015-12-21T08:27:31Z,oscargus,Oscar Gustafsson,64ee23753327964eab00437451fc810b2d5fc62a,src/main/java/net/sf/jabref/external/SynchronizeFileField.java,64ee23753327964eab00437451fc810b2d5fc62a,java.awt.event.ActionEvent,,User Interface,,0,0,0,0,0,0,0,0,0,0,0,0,0,0,0,0,0,0,0,0,0,0,0,0,0,0,0,0,1,0,0,1,1,0,0,1,1,1,0,1,1,1,1,1,1,1,1,1,1,1,0,0,1,1,1,0,1,0,0,0,0,0,0,1,0,0,0,0,0,0,0,0,0,0,0,0,0,1,1,0,0,0,0,0,0,0,0,0,0,0,0,0,0,0,0,0,0,0,1,0,0,0,0,0,0,1,0,0,0,1,0,0,1,0,0,0,1,0,0,0,0,0,0,0,0,0,0,0,0,0,0,0,0,0,0,0,0,0,0,0,0,0,0,0,0,0,0,0,0,0,0,0,0,0,0,0,0,0,0,0,0,0,0,0,0,0,0,0,1,1,1,1,0,0,1,0,0,0,0,0,0,0,0,0,0,0,0,0,0,0,0,0,0,0,0,0,1,1,1,1,0,0,1,0,0,0,0,0,0,0,0,0,0,0,0,0,0
