217,True,Remove the option move-to-systray,"Why? - only applications that do background work are put in the systray, e.g., Dropbox or Anti-Virus-software.  - other software stays in the normal task bar - JabRef currently does no background stuff, hence, should stay in the task bar only  Gains? - less code - lesser quirky workarounds (see commit) ",2015-10-07T08:47:43Z,2015-10-07T09:13:03Z,simonharrer,Simon Harrer,5e7042e982ae5bfcba2fd5f840c3b919d58a1dde,src/main/java/net/sf/jabref/gui/keyboard/KeyBinds.java,5e7042e982ae5bfcba2fd5f840c3b919d58a1dde,java.util.HashMap,,Data Structure,,0,0,0,0,0,0,0,0,0,0,0,0,0,0,0,0,0,0,0,0,0,0,0,0,0,0,0,0,0,0,0,0,0,0,0,1,0,0,0,0,0,0,0,0,0,0,0,0,0,1,0,0,1,0,0,0,0,0,0,0,0,0,0,0,0,0,0,0,0,0,0,0,0,0,0,0,0,0,0,0,0,0,0,0,0,0,0,0,0,0,0,0,0,0,0,0,0,0,1,0,0,0,0,0,0,1,0,0,0,0,0,0,0,0,0,0,0,0,0,0,0,0,0,0,0,0,0,0,0,0,0,0,0,0,0,0,0,0,0,0,0,0,0,0,0,0,0,0,0,0,0,0,0,0,0,0,0,0,0,0,0,0,0,0,0,0,0,0,0,0,0,0,0,0,0,0,0,0,0,0,0,0,0,0,0,0,0,0,0,0,0,0,0,0,0,0,0,0,0,0,0,0,0,0,0,0,0,0,0,0,0,0,0,0,0,0,0
218,True,AbstractPushToApplication,"Here's my go at an AbstractPushToApplication class. So far I've implemented PushToTexmaker.java using the new class. See the last commit, the earlier commit is primarily refactoring all these files to external.push.  Comments so far? I thought it might be a better idea to get some input on the construction of the abstract class before I continue converting the rest.  The abstract class will work ""out of the box"" if there's just a single path to be set. In that case one will have to define the four methods in PushToTexmaker: name, icon, command line, and an init, primarily meant to get the preference key (maybe better to have a `getPreferenceKey()`? I was originally thinking that maybe more preference values could be read in here in case of a more complicated configuration dialogue.)  (I know that I forgot to run auto-format for some files and also noted some other things that can be slightly improved, like in ExternalTab, but those will be sorted out eventually. Comments on AbstractPushToApplication.java and PushToTexmaker.java primarily. :-)) ",2015-10-07T16:04:42Z,2015-10-14T22:06:05Z,oscargus,Oscar Gustafsson,b93625d26d06082e3004e83594714ab895424dbc,src/main/java/net/sf/jabref/external/push/PushToVim.java,b93625d26d06082e3004e83594714ab895424dbc,java.io.IOException,,Error Handling,,0,0,0,0,0,0,0,0,0,0,0,0,0,0,0,0,0,0,0,0,0,0,0,0,0,0,0,0,1,1,0,1,1,0,1,1,0,1,0,0,1,1,1,0,0,0,0,0,0,1,0,0,1,1,1,0,1,0,0,0,0,0,0,1,0,0,0,0,0,0,0,0,0,0,0,0,0,1,0,0,1,0,0,0,1,0,0,0,0,0,0,0,0,0,0,0,0,0,0,0,0,0,0,0,0,1,0,0,0,1,0,0,1,0,0,0,1,0,0,0,0,0,0,0,0,0,0,0,0,0,0,0,0,0,0,0,0,0,0,0,0,0,0,0,0,0,0,0,0,0,0,0,0,0,0,0,0,0,0,0,0,0,0,0,0,0,0,0,1,0,0,0,0,0,0,0,0,0,0,0,0,0,0,0,0,0,0,0,0,0,0,0,0,0,0,0,1,1,1,0,0,0,0,0,0,0,0,0,0,0,0,0,0,0,0,0,0
219,True,IEEE journal abbreviations,"Why? - See #173   What is does: - bugfix: correct abbreviations are loaded when storing preferences through the advanced tab - IEEE abbreviations are either plain (text) or in latex (code) form. For each of them, a separate file exist now. The config option `USE_IEEE` loads the latex one if it is true, and the plain one otherwise. ",2015-10-08T13:54:07Z,2015-10-09T08:17:58Z,simonharrer,Simon Harrer,823ba0a4a0c320bc0730e3b45d501bf932b23960,src/main/java/net/sf/jabref/logic/journals/Abbreviations.java,823ba0a4a0c320bc0730e3b45d501bf932b23960,java.io.File,,Data Structure,,0,0,0,0,0,0,0,0,0,0,0,0,0,0,0,0,0,0,0,0,0,0,0,0,0,0,0,0,0,0,0,0,0,0,0,1,0,0,0,0,0,0,0,0,0,0,0,0,0,1,0,0,1,1,0,0,1,0,0,0,0,0,0,1,0,0,0,0,0,0,0,0,0,0,0,0,0,0,0,0,0,0,0,0,0,0,0,0,0,0,0,0,0,0,0,0,0,0,0,0,0,0,0,0,0,1,0,0,0,0,0,0,1,0,0,0,1,0,0,0,0,0,0,0,0,0,0,0,0,0,0,0,0,0,0,0,0,0,0,0,0,0,0,0,0,0,0,0,0,0,0,0,0,0,0,0,0,0,0,0,0,0,0,0,0,0,0,0,0,0,0,0,0,0,0,0,0,0,0,0,0,0,0,0,0,0,0,0,0,0,0,0,0,0,0,0,1,1,1,0,0,0,0,0,0,0,0,0,0,0,0,0,0,0,0,0,0
222,True,Backported bug fix in #193,Fixed a small bug that sometimes stalled the fetching. ,2015-10-09T06:26:21Z,2015-10-16T08:44:25Z,oscargus,Oscar Gustafsson,e9f4f3ec5b6c647c48c508f8f59a4060a4ee9010,src/main/java/net/sf/jabref/imports/IEEEXploreFetcher.java,e9f4f3ec5b6c647c48c508f8f59a4060a4ee9010,java.util.regex.Pattern,,Language,,0,0,0,0,0,0,0,0,0,0,0,0,0,0,0,0,0,0,0,0,0,0,0,0,0,0,0,0,0,0,0,0,0,0,0,1,0,0,0,1,0,1,0,0,0,0,0,0,0,0,0,0,0,0,0,0,1,0,0,0,0,0,0,0,0,0,0,0,0,0,0,0,0,0,0,0,0,1,1,0,1,0,0,0,0,0,0,0,0,0,0,0,0,0,0,0,0,0,0,0,0,0,0,0,0,1,0,0,0,1,0,0,0,0,0,0,0,0,0,0,0,0,0,0,0,0,0,0,0,0,0,0,0,0,0,0,0,0,0,0,0,0,0,0,0,0,0,0,0,0,0,0,0,0,1,0,1,1,0,0,0,0,0,0,0,0,0,0,0,0,0,0,0,0,0,0,0,0,0,0,0,0,0,0,0,0,0,0,0,0,0,0,0,0,0,0,1,1,1,0,0,0,0,0,0,0,0,0,0,0,0,0,0,0,0,0,0
225,True,Replaced DefaultFormBuilder with FormBuilder,"Another batch of replacing the deprecated DefaultFormBuilder with FormBuilder: AutoSetExternalFileForEntries, BasePanel, ColorSetupPanel, DBConnectDialog, FromAuxDialog, ManageKeywordsAction, MassSetFieldAction, and SynchronizeFileField.  Clean up in Util.java. ",2015-10-09T17:33:46Z,2015-10-10T07:45:11Z,oscargus,Oscar Gustafsson,3ff67d5e953b6e8c2cdbf61ea540c0a5f8238edf,src/main/java/net/sf/jabref/external/SynchronizeFileField.java,3ff67d5e953b6e8c2cdbf61ea540c0a5f8238edf,com.jgoodies.forms.layout.FormLayout,,Language,,0,0,0,0,0,0,0,0,0,0,0,0,0,0,0,0,0,0,0,0,0,0,0,0,0,0,0,0,1,0,0,0,0,0,0,1,0,1,0,1,1,1,1,1,1,0,1,0,1,1,0,0,1,1,1,0,1,0,0,0,0,0,0,1,0,0,0,0,0,0,0,0,0,0,0,0,0,0,0,0,0,0,0,0,0,0,0,0,0,0,0,0,0,0,0,0,0,0,1,0,0,0,0,0,0,1,0,0,0,1,0,0,1,0,0,0,1,0,0,0,0,0,0,0,0,0,0,0,0,0,0,0,0,0,0,0,0,0,0,0,0,0,0,0,0,0,0,0,0,0,0,0,0,0,0,0,0,0,0,0,0,0,0,0,0,0,0,0,1,1,1,1,0,0,1,1,0,0,0,0,0,0,0,0,0,0,0,0,0,0,0,0,0,0,0,0,1,1,1,0,0,0,1,1,0,0,0,0,0,0,0,0,0,0,0,0,0
226,True,Updating pt_BR translations,,2015-10-09T18:13:37Z,2015-10-09T19:51:14Z,igorsteinmacher,Igor Steinmacher,e97994f83eab4d734b471dbc3407038eb94f981e,src/main/java/net/sf/jabref/importer/HTMLConverter.java,e97994f83eab4d734b471dbc3407038eb94f981e,java.util.regex.Pattern,,Language,,0,0,0,0,0,0,0,0,0,0,0,0,0,0,0,0,0,0,0,0,0,0,0,0,0,0,0,0,1,1,0,1,1,0,1,1,1,1,0,1,1,1,1,1,1,1,1,1,1,1,0,0,1,1,1,0,1,0,0,0,0,0,0,1,0,0,0,0,0,0,0,0,0,0,0,0,0,1,1,1,1,0,0,0,0,0,0,0,0,0,0,0,0,0,0,0,0,0,1,0,0,0,0,0,0,1,1,0,0,1,0,0,1,0,0,0,1,0,0,0,0,0,0,0,0,0,0,0,0,0,0,0,0,0,0,0,0,0,0,0,0,0,0,0,0,0,0,0,0,0,0,0,0,0,1,0,1,1,0,0,0,0,0,0,0,0,0,0,1,1,1,1,0,0,1,1,0,0,0,0,0,0,0,0,0,0,0,0,0,0,0,0,0,0,0,0,1,1,1,0,0,0,1,1,0,0,0,0,0,0,0,0,0,0,0,0,0
227,True,Merge entries in duplicate detection,"Added a ""merged entry"" tab and preview/textbox in the DuplicateResolverDialog and added handling of this at import and duplicate checking.  Also fixed a bug leading to that if import was done without the ImportInspectionDialog, nullPointerException happened as the MetaData was not properly initialized. ",2015-10-10T17:26:57Z,2015-10-24T20:42:44Z,oscargus,Oscar Gustafsson,07ca454d409b4f7cf0119e7be9c22ba71f04a670,src/main/java/net/sf/jabref/gui/DuplicateResolverDialog.java,07ca454d409b4f7cf0119e7be9c22ba71f04a670,java.awt.event.ActionListener,,User Interface,,0,0,0,0,0,0,0,0,0,0,0,0,0,0,0,0,0,0,0,0,0,0,0,0,0,0,0,0,1,1,0,1,1,0,1,1,0,1,0,1,1,1,1,0,1,0,1,0,0,1,0,0,1,1,1,0,1,1,0,0,0,0,0,1,0,0,0,0,0,0,0,0,0,0,0,0,0,1,0,0,1,0,0,0,0,0,0,0,0,0,0,0,0,0,0,0,0,0,0,0,0,0,0,0,0,1,0,0,0,1,0,0,1,0,0,0,1,0,0,0,0,0,0,0,0,0,0,0,0,0,0,0,0,0,0,0,0,0,0,0,0,0,0,0,0,0,0,0,0,0,0,0,0,0,0,0,0,0,0,0,0,0,0,0,0,0,0,0,1,0,1,1,0,0,1,0,0,0,0,0,0,0,0,0,0,0,0,0,0,0,0,0,0,0,0,0,1,1,1,1,0,0,1,0,0,0,0,0,0,0,0,0,0,0,0,0,0
228,True,Alternative merge duplicate branch,"This branch should be identical to PR #227 but with only two commits. As said earlier, there are some things to be sorted out such as relevant naming, but unless there are some major objections, it can make sense to merge it now and I'll get around to fixing those things later. I'm a bit worried about all the merging/rebasing/getting hundreds of unrelated commits... ",2015-10-12T19:27:46Z,2015-10-12T19:38:27Z,oscargus,Oscar Gustafsson,0f2b253622e3d6f2a91519e95c340b7c03c394e2,src/main/java/net/sf/jabref/importer/ImportMenuItem.java,0f2b253622e3d6f2a91519e95c340b7c03c394e2,net.sf.jabref.model.entry.BibtexEntryType,,Software Development and IT Operations,,0,0,0,0,0,0,0,0,0,0,0,0,0,0,0,0,0,0,0,0,0,0,0,0,0,0,0,0,1,0,0,0,0,0,0,1,0,1,0,0,1,1,1,1,1,0,1,0,0,1,0,0,1,1,1,0,1,1,0,0,0,0,0,1,0,0,0,0,0,0,0,0,0,0,0,0,0,0,0,0,0,0,0,0,0,0,0,0,0,0,0,0,0,0,0,0,0,0,0,0,0,0,0,0,0,1,0,0,0,1,0,0,0,0,0,0,0,0,0,0,0,0,0,0,0,0,0,0,0,0,0,0,0,0,0,0,0,0,0,0,0,0,0,0,0,0,0,0,0,0,0,0,0,0,0,0,0,0,0,0,0,0,0,0,0,0,0,0,1,0,1,1,0,0,1,0,0,0,0,0,0,0,0,0,0,0,0,0,0,0,0,0,0,0,0,0,1,1,1,1,0,0,1,0,0,0,0,0,0,0,0,0,0,0,0,0,0
229,True,Removes non-compact rank symbols in favor of compact rank,"Why? - because it is ugly :taxi:  - keep consistent icon width - removes 140 lines of code, five icons, one preference check box ",2015-10-12T21:16:34Z,2015-10-13T06:57:07Z,simonharrer,Simon Harrer,07c11ce20fb93f6659531502c7b34dcab7e0a55b,src/main/java/net/sf/jabref/gui/GUIGlobals.java,07c11ce20fb93f6659531502c7b34dcab7e0a55b,javax.swing.JLabel,,User Interface,,0,0,0,0,0,0,0,0,0,0,0,0,0,0,0,0,0,0,0,0,0,0,0,0,0,0,0,0,1,1,0,1,1,0,1,1,0,1,0,1,1,1,1,0,1,0,0,0,0,1,0,0,1,1,0,0,1,0,0,0,0,0,0,1,0,0,0,0,0,0,0,0,0,0,0,0,0,1,0,0,1,0,0,0,0,0,0,0,0,0,0,0,0,0,0,0,0,0,0,0,0,0,0,0,0,1,0,0,0,1,0,0,1,0,0,0,1,0,0,0,0,0,0,0,0,0,0,0,0,0,0,0,0,0,0,0,0,0,0,0,0,0,0,0,0,0,0,0,0,0,0,0,0,0,0,0,0,0,0,0,0,0,0,0,0,0,0,0,1,0,1,1,0,0,1,1,0,0,0,0,0,0,0,0,0,0,0,0,0,0,0,0,0,0,0,0,1,1,1,1,0,0,1,0,0,0,0,0,0,0,0,0,0,0,0,0,0
230,True,New Iconset,"Also see #130  - [x] Unlike expected, PNG files do not look sharper than the font version for me - [x] Anyhow, we should go up to 24px as 16px seems way to small - [x] ~~Strangely, some icons are missing in the materialize Github repository, e.g. `settings`~~ not relevant - [x] We still have duplicated and unused icons in the properties file - [x] Open file icon should be either `file-pdf` or `file-document` (or `attachment`) depending on actual file type. - [x] How are icons for external file types handled? users cannot set this anymore, they have to use the default icons instead.  - [x] squash commits so that temporary binary files are not in the history - [x] separator are not removed when the icons are hidden (see special fields like rank) - [x] add information about used font into `external-libraries.txt` and update ""About"" content ",2015-10-12T22:55:40Z,2015-10-25T18:52:05Z,stefan-kolb,Oliver Kopp,f30f17fcc2001333a6e39fbb9c8457a4a53731a7,src/main/java/net/sf/jabref/gui/desktop/JabRefDesktop.java,f30f17fcc2001333a6e39fbb9c8457a4a53731a7,java.io.IOException,,Error Handling,,0,0,0,0,0,0,0,0,0,0,0,0,0,0,0,0,0,0,0,0,0,0,0,0,0,0,0,0,1,1,0,1,1,0,1,1,1,1,0,1,1,1,1,1,1,1,1,1,1,1,0,0,1,1,1,0,1,0,0,0,0,0,0,1,1,0,0,1,0,0,0,0,0,0,0,0,0,1,0,0,1,0,0,0,1,0,0,0,0,0,0,0,0,0,0,0,0,0,1,0,0,0,1,1,0,1,0,0,0,1,0,0,1,0,0,0,1,0,0,0,0,0,0,0,0,0,0,0,0,0,0,0,0,0,0,0,0,0,0,0,0,0,0,0,0,0,0,0,0,0,0,0,0,0,0,0,0,0,0,0,0,0,0,0,0,0,0,0,1,1,1,1,0,0,1,1,0,1,0,0,0,0,0,0,0,0,0,0,0,0,0,0,0,0,0,0,1,1,1,1,0,0,1,1,0,0,1,0,0,0,0,0,0,0,0,0,0
232,True,Architecture,Adds a the ArchitectureTests class that ensures that specific packages stay independent from other packages.  Why? - ensure that the architecture of JabRef stays healthy.  ,2015-10-13T15:28:27Z,2015-10-14T08:44:48Z,simonharrer,Simon Harrer,3a8c25c3637ab9ed3a14e29c068a61f6a5e209f6,src/main/java/net/sf/jabref/gui/desktop/JabRefDesktop.java,3a8c25c3637ab9ed3a14e29c068a61f6a5e209f6,java.io.IOException,,Error Handling,,0,0,0,0,0,0,0,1,0,0,0,0,0,0,0,0,0,0,0,0,0,0,0,0,0,0,0,0,1,1,0,1,1,0,1,1,1,1,1,1,1,1,1,1,1,1,1,1,1,1,0,0,1,1,1,1,1,1,0,0,0,0,0,1,1,0,0,1,0,0,0,0,0,0,0,0,0,1,1,1,1,1,0,0,1,0,0,0,0,0,0,0,0,0,0,0,0,0,1,0,0,0,0,0,0,1,1,0,0,1,0,1,1,0,0,0,1,0,0,0,0,0,0,0,0,0,0,0,0,0,0,0,0,0,0,0,0,0,0,0,0,0,0,0,0,0,0,0,0,0,0,0,0,0,0,0,0,0,0,0,0,0,0,0,0,0,0,0,1,1,1,1,0,0,1,1,0,0,0,0,0,0,0,0,0,0,0,0,0,0,0,0,0,0,0,0,1,1,1,1,0,0,1,1,0,0,1,0,1,0,0,0,0,0,0,0,0
235,True,Clean ups,"Purpose was to replace more DefaultFormBuilders, but ended up cleaning up minor issues and removed quite a bit of disabled code from IEEEXploreFetcher (bibtex fetching and multi-page search results), which has not been working for years, and added support for a few more publication types that IEEE Xplore has added. ",2015-10-14T22:32:38Z,2015-10-19T14:44:58Z,oscargus,Oscar Gustafsson,76228cfae8bf9a7dd1e94e8cb6ca5d62c228f785,src/main/java/net/sf/jabref/exporter/OpenDocumentRepresentation.java,76228cfae8bf9a7dd1e94e8cb6ca5d62c228f785,java.util.Set,,Data Structure,,0,0,0,0,0,0,0,0,0,0,0,0,0,0,0,0,0,0,0,0,0,0,0,0,0,0,0,0,1,0,0,0,0,0,0,1,0,1,0,1,1,1,1,1,0,0,0,0,0,1,0,0,1,1,1,1,1,0,0,0,0,0,0,0,0,0,0,0,0,0,0,0,0,0,0,0,0,1,0,0,1,0,0,0,0,0,0,0,0,0,0,0,0,0,0,0,0,0,0,0,0,0,0,0,0,1,0,0,0,1,0,0,1,0,0,0,1,0,0,0,0,0,0,0,0,0,0,0,0,0,0,0,0,0,0,0,0,0,0,0,0,0,0,0,0,0,0,0,0,0,0,0,0,0,1,0,1,1,0,0,0,0,0,0,0,0,0,0,1,1,1,0,0,0,1,0,0,0,0,0,0,0,0,0,0,0,0,0,0,0,0,0,0,0,0,0,1,1,1,0,0,0,1,1,0,0,0,0,0,0,0,0,0,0,0,0,0
236,True,Simplify key bindings,"Currently, there is a key binding for ""push to application"" but there can be key bindings for each specific application, e.g., LyX, Vim, etc.  To simplify, there should only be a key binding for the currently selected application, hence, only the ""push to application"" key binding.  ",2015-10-15T07:09:55Z,2015-10-15T09:03:26Z,simonharrer,Simon Harrer,2cc00c6a784d8c63febcaeb501d033d9838277e3,src/main/java/net/sf/jabref/external/push/PushToVim.java,2cc00c6a784d8c63febcaeb501d033d9838277e3,java.io.IOException,,Error Handling,,0,0,0,0,0,0,0,0,0,0,0,0,0,0,0,0,0,0,0,0,0,0,0,0,0,0,0,0,0,0,0,0,0,0,0,1,0,0,0,0,1,1,1,0,0,0,0,0,0,1,0,0,1,1,1,0,1,0,0,0,0,0,0,0,0,0,0,0,0,0,0,0,0,0,0,0,0,1,0,0,0,0,0,0,1,0,0,0,0,0,0,0,0,0,0,0,0,0,0,0,0,0,0,0,0,1,0,0,0,1,0,0,1,0,0,0,1,0,0,0,0,0,0,0,0,0,0,0,0,0,0,0,0,0,0,0,0,0,0,0,0,0,0,0,0,0,0,0,0,0,0,0,0,0,0,0,0,0,0,0,0,0,0,0,0,0,0,0,1,0,0,0,0,0,0,0,0,0,0,0,0,0,0,0,0,0,0,0,0,0,0,0,0,0,0,0,1,1,1,0,0,0,0,0,0,0,0,0,0,0,0,0,0,0,0,0,0
237,True,Less console output in tests,"Reduces console output during tests dramatically. This reduces the console output in travis, helping to find the cause for a failing test faster with less scrolling. ",2015-10-15T13:04:44Z,2015-10-15T21:05:24Z,simonharrer,Simon Harrer,c94db3fc6f5b1918e10d9fe1336e4983a46ae0d7,src/main/java/net/sf/jabref/bst/VM.java,c94db3fc6f5b1918e10d9fe1336e4983a46ae0d7,org.antlr.runtime.ANTLRStringStream,,Language,,0,0,0,0,0,0,0,0,0,0,0,0,0,0,0,0,0,0,0,0,0,0,0,0,0,0,0,0,0,0,0,0,0,0,0,1,0,1,0,0,0,1,1,1,0,1,0,0,0,1,0,0,0,0,0,0,1,0,0,0,0,0,0,0,0,0,0,0,0,0,0,0,0,0,0,0,0,0,0,0,0,0,0,0,0,0,0,0,0,0,0,0,0,0,0,0,0,0,0,0,0,0,0,0,0,1,0,0,0,1,0,0,1,0,0,0,1,0,0,0,0,0,0,0,0,0,0,0,0,0,0,0,0,0,0,0,0,0,0,0,0,0,0,0,0,0,0,0,0,0,0,0,0,0,0,0,0,0,0,0,0,0,0,0,0,0,0,0,1,1,0,0,0,0,0,0,0,0,0,0,0,0,0,0,0,0,0,0,0,0,0,0,0,0,0,0,0,0,0,0,0,0,0,0,0,0,0,0,0,0,0,0,0,0,0,0,0
241,True,Set default encoding to UTF-8,"The UTF-8 support of LaTeX, [biber](https://www.ctan.org/pkg/biber) and [LaTeX editors](http://tex.stackexchange.com/questions/339/latex-editors-ides) is really mature. To have interoperable `.bib` files, JabRef should set the default encoding (for new users) to `UTF-8` ",2015-10-15T20:58:17Z,2015-10-15T21:04:03Z,koppor,Oliver Kopp,f6a4a97faff20bc0a43ebcb81822a75579b4bee5,src/main/java/net/sf/jabref/JabRefPreferences.java,f6a4a97faff20bc0a43ebcb81822a75579b4bee5,java.util.prefs.InvalidPreferencesFormatException,,Error Handling,,0,0,0,0,0,0,0,0,0,0,0,0,0,0,0,0,0,0,0,0,0,0,0,0,0,0,0,0,1,1,0,1,1,0,1,1,0,1,0,0,0,1,0,0,0,0,0,0,0,1,0,0,1,1,0,0,1,0,0,0,0,0,0,0,0,0,0,0,0,0,0,0,0,0,0,0,0,1,0,0,1,0,0,0,0,0,0,0,0,0,0,0,0,0,0,0,0,0,0,0,0,0,0,0,0,1,0,0,0,1,0,0,1,0,0,0,1,0,0,0,0,0,0,0,0,0,0,0,0,0,0,0,0,0,0,0,0,0,0,0,0,0,0,0,0,0,0,0,0,0,0,0,0,0,0,0,0,0,0,0,0,0,0,0,0,0,0,0,1,0,0,0,0,0,0,0,0,0,0,0,0,0,0,0,0,0,0,0,0,0,0,0,0,0,0,0,1,0,1,0,0,0,0,0,0,0,0,0,0,0,0,0,0,0,0,0,0
242,True,Save button in StringDialog,"Added a save button in the edit string dialog. Useful when having a separate abbreviation file which you are editing at the same time as another .bib where you use the abbreviations, when you at the same time compile your LaTeX document. (May sound like a long story, but that is the standard work flow for me.)  Also, some unused and/or commented out code was removed. ",2015-10-15T22:32:22Z,2015-10-19T14:38:43Z,oscargus,Oscar Gustafsson,cb0d1610e4306d11e29525344f732a44b88cf9ac,src/main/java/net/sf/jabref/gui/StringDialog.java,cb0d1610e4306d11e29525344f732a44b88cf9ac,javax.swing.LayoutFocusTraversalPolicy,,User Interface,,0,0,0,0,0,0,0,0,0,0,0,0,0,0,0,0,0,0,0,0,0,0,0,0,0,0,0,0,1,0,0,0,0,0,0,1,0,0,0,0,0,0,1,1,0,1,1,0,0,1,0,0,0,0,0,0,1,0,0,0,0,0,0,0,0,0,0,0,0,0,0,0,0,0,0,0,0,0,0,0,0,0,0,0,1,0,0,0,0,0,0,0,0,0,0,0,0,0,0,0,0,0,0,0,0,1,0,0,0,1,0,0,0,0,0,0,0,0,0,0,0,0,0,0,0,0,0,0,0,0,0,0,0,0,0,0,0,0,0,0,0,0,0,0,0,0,0,0,0,0,0,0,0,0,0,0,0,0,0,0,0,0,0,0,0,0,0,0,1,0,0,0,0,0,0,0,0,0,0,0,0,0,0,0,0,0,0,0,0,0,0,0,0,0,0,0,1,1,1,0,0,0,1,0,0,0,0,0,0,0,0,0,0,0,0,0,0
246,True,Save shortcut and cleanups in Stringdialog,"Removed the button, but kept the shortcut plus all the cleanups from the previous PR. ",2015-10-19T19:30:34Z,2015-10-20T18:54:44Z,oscargus,Oscar Gustafsson,5ca621f55040c31a7e84928f7dda0e1ef8af0013,src/main/java/net/sf/jabref/gui/StringDialog.java,5ca621f55040c31a7e84928f7dda0e1ef8af0013,javax.swing.LayoutFocusTraversalPolicy,,User Interface,,0,0,0,0,0,0,0,0,0,0,0,0,0,0,0,0,0,0,0,0,0,0,0,0,0,0,0,0,1,0,0,0,0,0,0,1,0,0,0,0,0,0,1,1,0,1,1,0,0,1,0,0,0,0,0,0,1,0,0,0,0,0,0,0,0,0,0,0,0,0,0,0,0,0,0,0,0,0,0,0,0,0,0,0,1,0,0,0,0,0,0,0,0,0,0,0,0,0,0,0,0,0,0,0,0,1,0,0,0,1,0,0,0,0,0,0,0,0,0,0,0,0,0,0,0,0,0,0,0,0,0,0,0,0,0,0,0,0,0,0,0,0,0,0,0,0,0,0,0,0,0,0,0,0,0,0,0,0,0,0,0,0,0,0,0,0,0,0,1,0,0,0,0,0,0,0,0,0,0,0,0,0,0,0,0,0,0,0,0,0,0,0,0,0,0,0,1,1,1,0,0,0,1,0,0,0,0,0,0,0,0,0,0,0,0,0,0
248,True,Removes button to merge entries and keep the old ones.,"- Renames merge button into ""Merge entries"". - Removes button to merge entries and keep the old ones. The old ones are now always deleted. ",2015-10-20T08:54:39Z,2015-10-20T21:59:16Z,simonharrer,Simon Harrer,73f3b76e983bebb5fac55a80867f92648c56230e,src/main/java/net/sf/jabref/gui/mergeentries/MergeEntriesDialog.java,73f3b76e983bebb5fac55a80867f92648c56230e,net.sf.jabref.gui.undo.NamedCompound,,Parser,,0,0,0,0,0,0,0,0,0,0,0,0,0,0,0,0,0,0,0,0,0,0,0,0,0,0,0,0,0,0,0,0,0,0,0,1,0,0,0,0,0,0,0,0,0,0,0,0,0,1,0,0,1,1,1,0,0,0,0,0,0,0,0,0,0,0,0,0,0,0,0,0,0,0,0,0,0,0,0,0,0,0,0,0,0,0,0,0,0,0,0,0,0,0,0,0,0,0,0,0,0,0,0,0,0,1,0,0,0,1,0,0,0,0,0,0,0,0,0,0,0,0,0,0,0,0,0,0,0,0,0,0,0,0,0,0,0,0,0,0,0,0,0,0,0,0,0,0,0,0,0,0,0,0,0,0,0,0,0,0,0,0,0,0,0,0,0,0,1,0,1,0,0,0,1,0,0,0,0,0,0,0,0,0,0,0,0,0,0,0,0,0,0,0,0,0,1,1,1,0,0,0,0,0,0,0,0,0,0,0,0,0,0,0,0,0,0
251,True,"Removes legacy options to sync files in the ""pdf"" or ""ps"" field","Why? - these legacy actions are replaced by using the ""file"" field and a much more sophisticated file sync action.  ",2015-10-22T13:00:39Z,2015-10-23T13:42:38Z,simonharrer,Simon Harrer,2facc25d383f6970e825100aa872e1291a678c97,src/main/java/net/sf/jabref/gui/preftabs/ExternalTab.java,2facc25d383f6970e825100aa872e1291a678c97,com.jgoodies.forms.builder.DefaultFormBuilder,,User Interface,,0,0,0,0,0,0,0,0,0,0,0,0,0,0,0,0,0,0,0,0,0,0,0,0,0,0,0,0,0,0,0,0,0,0,0,1,0,1,0,1,1,1,1,1,1,0,1,0,1,1,0,0,1,0,1,0,1,0,0,0,0,0,0,1,0,0,0,0,0,0,0,0,0,0,0,0,0,0,0,0,0,0,0,0,0,0,0,0,0,0,0,0,0,0,0,0,0,0,1,0,0,0,0,0,0,1,0,0,0,1,0,0,1,0,0,0,1,0,0,0,0,0,0,0,0,0,0,0,0,0,0,0,0,0,0,0,0,0,0,0,0,0,0,0,0,0,0,0,0,0,0,0,0,0,0,0,0,0,0,0,0,0,0,0,0,0,0,0,1,1,0,1,0,0,0,1,0,0,0,0,0,0,0,0,0,0,0,0,0,0,0,0,0,0,0,0,1,1,1,0,0,0,1,0,0,0,0,0,0,0,0,0,0,0,0,0,0
252,True,Update supported lookAndFeels,"I propose to update the list of supported lookAndFeels: - The FQCN for the `jgoodies` LaFs were wrong - the ""`javax.swing.plaf.mac.MacLookAndFeel`"" is not available on Windows and not chosable on Macs either (as the whole input field is hidden on a Mac (see https://github.com/JabRef/jabref/blob/1a0d23b64efa72f5184ad7f4100a428b7cc06040/src/main/java/net/sf/jabref/gui/preftabs/AdvancedTab.java#L123-L148) - `com.sun.java.swing.plaf.motif.MotifLookAndFeel` looks like this:    ![jabref_metal](https://cloud.githubusercontent.com/assets/676652/10665721/8a474c96-78cd-11e5-8f3a-f46afba25229.png) ",2015-10-22T13:00:59Z,2015-10-23T10:17:34Z,matthiasgeiger,matthiasgeiger,bfb8c81caa027f72846bb423f06db58f0b90e06f,src/main/java/net/sf/jabref/gui/preftabs/AdvancedTab.java,bfb8c81caa027f72846bb423f06db58f0b90e06f,javax.swing.JPanel,,User Interface,,0,0,0,0,0,0,0,0,0,0,0,0,0,0,0,0,0,0,0,0,0,0,0,0,0,0,0,0,0,0,0,0,0,0,0,1,0,0,0,0,0,0,0,0,0,0,0,0,0,1,0,0,1,1,0,0,0,0,0,0,0,0,0,1,0,0,0,0,0,0,0,0,0,0,0,0,0,0,0,0,0,0,0,0,0,0,0,0,0,0,0,0,0,0,0,0,0,0,0,0,0,0,0,0,0,1,0,0,0,0,0,0,0,0,0,0,0,0,0,0,0,0,0,0,0,0,0,0,0,0,0,0,0,0,0,0,0,0,0,0,0,0,0,0,0,0,0,0,0,0,0,0,0,0,0,0,0,0,0,0,0,0,0,0,0,0,0,0,0,0,0,0,0,0,0,0,0,0,0,0,0,0,0,0,0,0,0,0,0,0,0,0,0,0,0,0,1,1,1,0,0,0,0,0,0,0,0,0,0,0,0,0,0,0,0,0,0
253,True,Cleanup preferences,"This PR remove preferences that are no longer used in JabRef.  I checked the usage each public field of `JabRefPreferences` and, if there was no such usage, searched for String occurrences of the preference value in the complete project. If such usage was found, I replaced it with a usage of the respective field. Otherwise, I deleted the preference.  All in all, only a surprisingly small amount of preferences is not used. ",2015-10-22T13:35:52Z,2015-10-23T10:15:58Z,lenhard,Joerg Lenhard,2e0a9701298a6859fb5f7c94584cde7723365ac1,src/main/java/net/sf/jabref/JabRefPreferences.java,2e0a9701298a6859fb5f7c94584cde7723365ac1,java.util.prefs.InvalidPreferencesFormatException,,Error Handling,,0,0,0,0,0,0,0,0,0,0,0,0,0,0,0,0,0,0,0,0,0,0,0,0,0,0,0,0,1,1,0,1,1,0,1,1,0,1,0,1,0,1,0,0,0,0,0,0,0,1,0,0,1,1,0,0,1,0,0,0,0,0,0,0,0,0,0,0,0,0,0,0,0,0,0,0,0,1,0,0,1,0,0,0,0,0,0,0,0,0,0,0,0,0,0,0,0,0,0,0,0,0,0,0,0,1,0,0,0,1,0,0,1,0,0,0,1,0,0,0,0,0,0,0,0,0,0,0,0,0,0,0,0,0,0,0,0,0,0,0,0,0,0,0,0,0,0,0,0,0,0,0,0,0,0,0,0,0,0,0,0,0,0,0,0,0,0,0,1,0,0,1,0,0,0,0,0,0,0,0,0,0,0,0,0,0,0,0,0,0,0,0,0,0,0,0,1,1,0,1,0,0,1,0,0,0,0,0,0,0,0,0,0,0,0,0,0
255,True,Added JComboBox in MassSetFieldDialog,"Added a JComboCox for ""field"" in MassSetFieldDialog (Set/clear/rename field in right-click menu).  Seemed to be quite convenient compared to typing the field name. ",2015-10-23T19:24:20Z,2015-10-25T18:09:17Z,oscargus,Oscar Gustafsson,169696c12db8cacedd24b5ebceda55a3e402ca30,src/main/java/net/sf/jabref/util/MassSetFieldAction.java,169696c12db8cacedd24b5ebceda55a3e402ca30,net.sf.jabref.gui.undo.NamedCompound,,Parser,,0,0,0,0,0,0,0,0,0,0,0,0,0,0,0,0,0,0,0,0,0,0,0,0,0,0,0,0,0,0,0,0,0,0,0,1,0,0,0,1,1,1,0,0,0,0,0,0,0,1,0,0,1,0,1,0,1,0,0,0,0,0,0,1,0,0,0,1,0,0,0,0,0,0,0,0,0,0,0,0,0,0,0,0,0,0,0,0,0,0,0,0,0,0,0,0,0,0,0,0,0,0,0,0,0,1,0,0,0,1,0,0,1,0,0,0,1,0,0,0,0,0,0,0,0,0,0,0,0,0,0,0,0,0,0,0,0,0,0,0,0,0,0,0,0,0,0,0,0,0,0,0,0,0,0,0,0,0,0,0,0,0,0,0,0,0,0,0,1,0,1,0,0,0,1,0,0,0,0,0,0,0,0,0,0,0,0,0,0,0,0,0,0,0,0,0,1,1,1,0,0,0,0,1,0,0,0,0,0,0,0,0,0,0,0,0,0
256,True,"Bug fix in color preferences, replaced DefaultFormBuilder and clean ups",Fixed a bug in color preferences recently introduced.  Replaced the deprecated DefaultFormBuilder by FormBuilder in DatabasePropertiesDialog.  Removed some casts which weren't required. ,2015-10-23T22:33:30Z,2015-10-24T07:09:17Z,oscargus,Oscar Gustafsson,1dfd6fe6fe31b778cf7deee01d79599480724008,src/main/java/net/sf/jabref/gui/ColorSetupPanel.java,1dfd6fe6fe31b778cf7deee01d79599480724008,java.util.ArrayList,,Language,,0,0,0,0,0,0,0,0,0,0,0,0,0,0,0,0,0,0,0,0,0,0,0,0,0,0,0,0,1,1,0,1,1,0,1,1,0,1,0,1,0,1,0,0,0,0,0,0,0,1,0,0,1,1,0,0,1,0,0,0,0,0,0,1,1,0,0,1,0,0,0,0,0,0,0,0,0,1,0,0,1,0,0,0,0,0,0,0,0,0,0,0,0,0,0,0,0,0,1,0,1,0,1,0,0,1,0,0,0,1,0,0,1,0,0,0,1,0,0,0,0,0,0,0,0,0,0,0,0,0,0,0,0,0,0,0,0,0,0,0,0,0,0,0,0,0,0,0,0,0,0,0,0,0,0,0,0,0,0,0,0,0,0,0,0,0,0,0,1,0,0,1,0,0,1,0,0,0,0,0,0,0,0,0,0,0,0,0,0,0,0,0,0,0,0,0,1,1,1,0,0,0,1,0,0,0,0,0,0,0,0,0,0,0,0,0,0
259,True,"Fixed some warnings, missing copyright statements, and some minor issues","PushToEmacs is causing formatting problems (works with manual formatting), but other than that, I believe that everything should be OK.  ",2015-10-25T20:13:19Z,2015-10-26T10:13:46Z,oscargus,Oscar Gustafsson,ef0cd5d3d616a40cf0788e00a30e61a904c7f8ad,src/main/java/net/sf/jabref/importer/HTMLConverter.java,ef0cd5d3d616a40cf0788e00a30e61a904c7f8ad,java.util.regex.Matcher,,Language,,0,0,0,0,0,0,0,0,0,0,0,0,0,0,0,0,0,0,0,0,0,0,0,0,0,0,0,0,1,0,0,1,1,0,1,1,1,1,1,1,1,1,1,1,1,1,1,1,1,1,0,0,1,1,1,1,1,0,1,0,0,0,0,1,1,0,0,1,0,0,0,0,0,0,0,0,0,1,1,0,1,1,0,0,0,0,0,0,0,0,0,0,0,0,0,0,0,0,1,1,1,0,1,1,0,1,0,0,0,1,0,1,1,0,0,0,1,0,0,0,0,0,0,0,0,0,0,0,0,0,0,0,0,1,0,0,0,0,0,0,0,0,0,0,0,0,0,0,0,0,0,0,0,0,1,0,1,1,0,0,0,0,0,0,0,0,0,0,1,1,1,1,0,0,1,1,0,1,0,0,0,0,0,0,0,0,0,0,0,0,0,0,0,0,0,0,1,1,1,1,0,0,1,1,0,0,0,0,0,0,0,0,0,0,0,0,0
261,True,[WIP] Enable merge entries at context menu,"When selecting two entries, the context menu should offer merging of them, too. - [ ] When only one entry is selected, the ""Merge entries"" entry should be disabled. ",2015-10-26T00:10:14Z,2015-12-15T16:35:18Z,koppor,Oliver Kopp,528083d3446aec43e3310cf11d81406793a01287,src/main/java/net/sf/jabref/gui/RightClickMenu.java,528083d3446aec43e3310cf11d81406793a01287,java.awt.event.ActionEvent,,User Interface,,0,0,0,0,0,0,0,0,0,0,0,0,0,0,0,0,0,0,0,0,0,0,0,0,0,0,0,0,0,0,0,0,0,0,0,1,0,1,0,1,1,1,0,0,0,0,0,0,0,1,0,0,1,0,0,0,0,0,0,0,0,0,0,0,0,0,0,0,0,0,0,0,0,0,0,0,0,0,0,0,0,0,0,0,0,0,0,0,0,0,0,0,0,0,0,0,0,0,0,0,0,0,0,0,0,0,0,0,0,0,0,0,1,0,0,0,1,0,0,0,0,0,0,0,0,0,0,0,0,0,0,0,0,0,0,0,0,0,0,0,0,0,0,0,0,0,0,0,0,0,0,0,0,0,0,0,0,0,0,0,0,0,0,0,0,0,0,0,0,0,0,0,0,0,0,0,0,0,0,0,0,0,0,0,0,0,0,0,0,0,0,0,0,0,0,0,1,0,0,0,0,0,0,1,0,0,1,0,0,0,0,0,0,0,0,0,0
